<?xml version="1.0" encoding="UTF-8"?>
<!--
  -  Copyright 2001-2008 Geert Bevin <gbevin[remove] at uwyn dot com>
  -  Licensed under the Apache License, Version 2.0 (the "License")
  -  $Id: statesession.xml 3918 2008-04-14 17:35:35Z gbevin $
  -->

<!DOCTYPE site SYSTEM "/dtd/site.dtd">

<site>
	<state store="session">
		<!-- SUBMISSIONS -->
		<element id="INPUTSPRESERVED" file="element/submission/inputspreserved.xml" url="/submissions/inputspreserved"/>
		<element id="FILEUPLOAD_SIMPLE" file="element/submission/fileupload.xml" url="/fileupload/simple"/>
	
		<!-- EXITS DIRECT LINK -->
		<state store="query">
			<element id="DIRECTLINK_SOURCE" file="element/exits/directlink_source.xml" url="/exits/directlink/source">
				<flowlink srcexit="exit1" destid="DIRECTLINK_DESTINATION"/>
				<datalink srcoutput="output1" destid="DIRECTLINK_DESTINATION" destinput="input1"/>
				<datalink srcoutput="output2" destid="DIRECTLINK_DESTINATION" destinput="input2"/>
			</element>
		</state>
		<element id="DIRECTLINK_DESTINATION" file="element/exits/directlink_destination.xml" url="/exits/directlink/destination"/>
	
		<!-- EXITS GENERATED URL -->
		<state store="query">
			<element id="GENERATEDURL_SOURCE" file="element/exits/generatedurl_source.xml" url="/exits/generatedurl/source">
				<flowlink srcexit="exit1" destid="GENERATEDURL_DESTINATION1"/>
				<flowlink srcexit="exit2" destid="GENERATEDURL_DESTINATION2"/>
				<datalink srcoutput="output1" destid="GENERATEDURL_DESTINATION1" destinput="input1"/>
				<datalink srcoutput="output2" destid="GENERATEDURL_DESTINATION1" destinput="input2"/>
				<datalink srcoutput="output2" destid="GENERATEDURL_DESTINATION2" destinput="input1"/>
				<datalink srcoutput="output3" destid="GENERATEDURL_DESTINATION2" destinput="input2"/>
			</element>
		</state>
		<element id="GENERATEDURL_DESTINATION1" file="element/exits/generatedurl_destination1.xml" url="/exits/generatedurl/destination1"/>
		<element id="GENERATEDURL_DESTINATION2" file="element/exits/generatedurl_destination2.xml" url="/exits/generatedurl/destination2"/>
	
		<!-- EXITS DIRECT LINK QUERYSTATE-->
		<element id="DIRECTLINK_SOURCE_QUERYSTATE" file="element/exits/directlink_source.xml" url="/exits/directlink/source/querystate">
			<flowlink srcexit="exit1" destid="DIRECTLINK_DESTINATION_QUERYSTATE"/>
			<datalink srcoutput="output1" destid="DIRECTLINK_DESTINATION_QUERYSTATE" destinput="input1"/>
			<datalink srcoutput="output2" destid="DIRECTLINK_DESTINATION_QUERYSTATE" destinput="input2"/>
		</element>
		<state store="query">
			<element id="DIRECTLINK_DESTINATION_QUERYSTATE" file="element/exits/directlink_destination.xml" url="/exits/directlink/destination/querystate"/>
		</state>
		
		<!-- SUBSITE -->
		<subsite id="SUBSITE" file="site/subsite/statesession.xml" urlprefix="/subsite"/>
		
	</state>
</site>

